{
  "schema_version": "0.1",
  "contract": "action-separation-verifier-evidence",
  "sequence_id": "hero-walk-v1",
  "action_id": "walk",
  "frame_id": "walk.00",
  "frame_index": 0,
  "image_sha256": "75ce90653a01a23bcfab1aef83647d6364d3edbf6e4a44b84c635338c12b9248",
  "identity_lock_sha256": "59d6b09622b19839b8c9342fb043965ea3f515c8979d769284d413f60a5f7e2d",
  "generator_agent_id": "motionloom-generator-v1",
  "verifier_id": "motionloom-separation-verifier-v1",
  "result": {
    "expected_action": "walk",
    "top_competitor": "run",
    "margin": 0.42,
    "threshold": 0.2,
    "status": "pass",
    "method": "independent-action-rubric-v1"
  },
  "result_sha256": "c1e08d34fc0fab0c32a6eb1ad2c8e5e4c2c659f91a0d2f8295759c6c8e5fd804",
  "provenance": {
    "kind": "separate_verifier_artifact",
    "producer_id": "motionloom-independent-verifier-v1",
    "run_id": "fixture-run-2026-08-22"
  }
}
